transcript_id,timestamp,text,speaker
71,12:51,These are the Sigma X mock tests.,agent
71,12:53,"So if you're an AG mad student, you'll go and you'll take the mock test #1 if you look at this student, the student took a mock test, got a 595 to begin with.",agent
71,13:01,He's executed the entire study plan.,agent
71,13:04,Got to 715-7051.,agent
71,13:06,The mock test on the real GMAT as well.,agent
71,13:08,Go to a 705.,agent
71,13:09,That's how your journey would look like.,agent
71,13:10,"Mock test #1 would be a low score, but the other mock test will be high scores because you executed the study plan like that.",agent
71,13:16,"That, that, that is the idea.",agent
71,13:18,Now what we are looking for in mock test number one is you have a 595 score.,agent
71,13:22,"Let's say, OK, fine, 595.",agent
71,13:25,"Within that 595, what is your verbal percentile?",agent
71,13:28,What is your quant percentile?,agent
71,13:30,What is your data insights percentile?,agent
71,13:32,We want to know that.,agent
71,13:33,"Now when I look at this, I can clearly say that this student is naturally weaker on the verbal side, but this guy has good skills by default in data insights.",agent
71,13:42,"Naturally, this guy is stronger there in your case as well.",agent
71,13:45,We'll see.,agent
71,13:46,"Handily speaking, what do you think about your strengths and weaknesses?",agent
71,13:49,"Verbal, quant and data insights, how would they be?",agent
71,13:53,Are you comfortable in quant or verbal?,agent
71,13:56,Verbal and both you're you would be comfortable.,prospect
71,14:01,Is that what you're saying?,agent
71,14:02,Yeah.,prospect
71,14:04,OK.,agent
71,14:04,So there is no specific strength and weaknesses.,agent
71,14:06,Probably everything could be a good area.,agent
71,14:08,That's what you're saying.,agent
71,14:10,Data in text.,prospect
71,14:12,"I, I'm a little confused, but OK, Data insights could be probably a weak area because you're not familiar with those type of questions.",prospect
71,14:22,Maybe.,prospect
71,14:23,"Yeah, that's why probably.",prospect
71,14:24,"OK, we'll see.",agent
71,14:25,"So when you take the mock test, that observation gets quantified.",agent
71,14:29,"So you might get a very low score in data insights in the mock test, but get a good score in verbal and probably we'll see that.",agent
71,14:35,"Now another thing which we which the mock test will tell us is within Verbal in CR and RC, what are the current percentile scores?",agent
71,14:44,"Maybe in Verbal, you are naturally good and critical reasoning, you get a higher starting score, but you are slightly on the weaker side.",agent
71,14:51,"On reading comprehension, we'll get to know that.",agent
71,14:53,"Similarly in quant as well, we'll get to see your percentiles in algebra and arithmetic.",agent
71,14:58,"When you take the real GMAT or a mock test on officialmba.com, you'll get the same results, similar results where all these data points.",agent
71,15:06,"So in the in the EGMAT mock test as well, we are giving all these data points.",agent
71,15:10,So data insights have these four types of sections.,agent
71,15:13,All these sections you'll have starting scores.,agent
71,15:15,This is step number number one.,agent
71,15:16,"Take a mock test, 2 1/2 hours, proper ideals conditions, you'll sit and you'll take a mock test.",agent
71,15:22,This would happen.,agent
71,15:22,This is step number one.,agent
71,15:24,Step #2 is that you'll spend 5 to 10 minutes on this tool called Personalized Study Planner tool.,agent
71,15:30,"It will take the entire mock test score as an input, which will ask you some other questions as well.",agent
71,15:35,"At the end, you will see a framework that looks something like this.",agent
71,15:39,This is the main study plan framework here.,agent
71,15:42,This is the dummy study plan I created for a different student.,agent
71,15:45,I will will not worry about that.,agent
71,15:47,"We'll, we'll worry about the philosophy of it.",agent
71,15:49,What exactly does this mean and why?,agent
71,15:51,Why it is important for you.,agent
71,15:53,"So in this student's case, 545 is the starting score.",agent
71,15:56,This student wants to get to 695.,agent
71,15:58,"In your case, you want to get to 705, little bit higher score, but 695 also is good for us.",agent
71,16:03,"If you get a 695, that's more than good enough.",agent
71,16:06,We'll we'll accept that now.,agent
71,16:09,"Number one is that on the left hand side, you'll see all these current scores.",agent
71,16:15,"This student is slightly stronger in critical reasoning, weaker in reading comprehension, slightly stronger in arithmetic, little bit weaker in algebra.",agent
71,16:24,That's what these numbers mean.,agent
71,16:26,"Now to get to a 695, there are specific targets.",agent
71,16:30,"Because you are stronger in critical reasoning, you are given a bigger target score, and because you are weaker in reading comprehension, you are given a smaller target score.",agent
71,16:39,"So somewhere a very high target score, somewhere slightly lower target score.",agent
71,16:43,But the combination of all these numbers together will give us that 695 the tool determines automatically.,agent
71,16:51,And this is this step is very important because you will get to your overall target in less amount of time.,agent
71,16:57,"If you customize your targets in your stronger area, you need less time to get a higher score.",agent
71,17:02,"In your weaker area, you're not even aiming for a higher score.",agent
71,17:05,So you'll get done faster.,agent
71,17:06,That's the idea.,agent
71,17:07,So this this part is very important.,agent
71,17:10,"Then we, we can actually tell this tool that I can study 4 hours every day, you know, weekends I can study a little bit more amount of time, I can study 38 hours on a weekly basis.",agent
71,17:22,"If I study at that rate, by when can I take the GMAT?",agent
71,17:27,How much time will I need for GMAT?,agent
71,17:28,"For example, this student can take the GMAT by 26th of March at that rate of time investment.",agent
71,17:37,"So if you start the preparation right away, you can take the GMAT by 26th of March.",agent
71,17:41,"But I want to take the GMAT by you, you, I, I means you, you have to take the GMAT by 15th of March or 14th of March, little bit earlier, right?",agent
71,17:52,"So how can, how would you do that?",agent
71,17:54,So what you will have to do is you will have to beat the clock.,agent
71,17:57,"For example, in critical reasoning, it will take about 1 1/2 weeks to get to a 90th percentile.",agent
71,18:03,"1 1/2 weeks is what, 8 days or so.",agent
71,18:05,"So if you start the critical reasoning preparation today, on day eight you will have a 90th percentile, but you need to try and achieve give that 90th percentile not on day 8 but on day six.",agent
71,18:17,You have to save two days time.,agent
71,18:18,"Similarly in reading comprehension, you have to save two days time.",agent
71,18:21,In arithmetic you have to save a couple of days time.,agent
71,18:23,If you do that then you will you will hit that 15th of March deadline.,agent
71,18:28,That is the idea.,agent
71,18:30,"So that that is number 1 #2 let's say you don't have a 545, let's say you have a 605 scores to begin with.",agent
71,18:38,Then then automatically the tool itself will tell you that you can get ready by 13th of March.,agent
71,18:43,"So the more score improvement we need, the more amount of effort it takes to get a higher score.",agent
71,18:50,That that's the only thing.,agent
71,18:51,So that's the idea.,agent
71,18:53,"So if if the if the tool is saying you have to take the GMAT little bit farther than your target GMAT score, the only way to achieve your target by March 15th is by saving some time in every subsection.",agent
71,19:06,That that is the idea.,agent
71,19:07,There.,agent
71,19:08,"Now this part is clear, right?",agent
71,19:10,"The timeline part, yeah.",prospect
71,19:12,"Now coming to the overall execution part of it, because you're a beginner to the preparation as of now.",agent
71,19:20,"In the beginning, first 2-3 weeks, you should try to focus on one thing at a time.",agent
71,19:26,You should not mix things up.,agent
71,19:28,"That means this is how it will go tomorrow, Tomorrow only you'll kind of have to make a decision and start actually, unfortunately we don't have any time.",agent
71,19:35,So I'm saying tomorrow.,agent
71,19:36,Tomorrow you'll start the preparation with verbal.,agent
71,19:38,"Within verbal, you'll start the preparation with critical reasoning.",agent
71,19:41,"And for the next entire one week, only critical reasoning, nothing else.",agent
71,19:46,"No RC, no quant, no data inserts, complete focus on critical reasoning.",agent
71,19:50,"To become an expert in critical reasoning, At the end of that one week, we will give you a bunch of tests.",agent
71,19:56,"In all those tests, you have to get this 90th percentile.",agent
71,19:59,"If that happens, you're done with CR.",agent
71,20:02,"That is the idea there, what what to do in that one week.",agent
71,20:05,I'll show it to you.,agent
71,20:05,But that's the idea.,agent
71,20:06,"So start tomorrow, spend one week on critical reasoning, get to a 90th percentile score, then come to reading comprehension.",agent
71,20:14,"Spend another one week on reading comprehension, get to an 80th percentile score, then go to quant.",agent
71,20:19,"In quant again, you'll spend another two weeks, arithmetic first, then algebra, and you'll try to achieve these target scores.",agent
71,20:25,"But here when you are studying two weeks for quant, you won't you won't just leave verbal aside you during the weekends you will spend little bit more time and take some verbal mock tests.",agent
71,20:39,That way you'll stay in touch with the verbal topic without forgetting about it and the scores also should be good.,agent
71,20:44,Then we'll come to data insights.,agent
71,20:46,"You're not fully familiar with data insights, so we'll spend about 3 weeks or so in data insights and the one topic at a time we'll pick up, We'll try to achieve the target scores.",agent
71,20:55,"And while doing data insights for three weeks, every weekend you will take verbal and quant sectional mock test together back-to-back.",agent
71,21:04,So that way you are trying to build the stamina for the main test as well.,agent
71,21:07,Every year earlier you handled only verbal tests.,agent
71,21:10,Now we are adding quant tests into the mix.,agent
71,21:12,Then we will add data data insert tests into the mix as well.,agent
71,21:16,Then finally we'll take the full length mock tests like that.,agent
71,21:19,"So in the EG MAT course, you have about 55 zero sectional mock tests.",agent
71,21:24,"You won't take all of them, no need to take all of them, but they are there and you have the full length mock tests as well.",agent
71,21:29,"So that's how it is how, how to divide the next 1 1/2 month.",agent
71,21:33,"That was clear, right?",agent
71,21:34,"Two weeks for verbal, 2 weeks for quant, 3 weeks for data inserts like that.",agent
71,21:37,"OK, now let's go to the execution part.",agent
71,21:42,So I said start the preparation tomorrow with critical reasoning and with verbal and within one week wrap it up.,agent
71,21:49,So exactly how that one week would look like.,agent
71,21:51,I'll give you that understanding.,agent
71,21:53,That way you'll have a much more clearer picture.,agent
71,21:55,"So whatever the learning architecture that we discussed for critical reasoning right now, the learning architecture remains same for every other topic as well.",agent
71,22:05,So that that that part is there.,agent
71,22:07,Now let's go and see the critical reasoning part.,agent
71,22:10,So let's go to this verbal and master.,agent
71,22:15,So critical reasoning is here.,agent
71,22:17,We'll have to start the preparation with critical reasoning.,agent
71,22:21,Right now we are interested in learning a bunch of things and practicing a bunch of things in critical reasoning.,agent
71,22:28,Then we will do the testing part.,agent
71,22:29,The stage #2 is the testing part.,agent
71,22:31,Stage number one is the learning practice part.,agent
71,22:34,"And before critical reasoning, you will notice there is a foundation module called master comprehension.",agent
71,22:40,"Let's say you took a mock test tomorrow morning, and in the mock test, your verbal score came out to be slightly lower.",agent
71,22:47,Slightly lower means 40 percentile or 50 percentile or lower than that.,agent
71,22:52,That means basics and foundation is not good.,agent
71,22:55,"So we have to start the preparation from basics and foundation, which is called master comprehension.",agent
71,22:59,That's the idea.,agent
71,23:00,Let's say tomorrow in the mock test you got a 70 percentile in verbal.,agent
71,23:04,Then we don't need to worry about the basics.,agent
71,23:06,"So it it really depends on the starting score right now, I'm assuming that I know you're just new to the GMAT and beginner.",agent
71,23:14,Probably you may get a little bit lower score.,agent
71,23:16,"I'm assuming that if you get a good score tomorrow, I'm I'll be very happy.",agent
71,23:19,But but that we'll discuss based on as if you're going to get a little bit lower score.,agent
71,23:23,"So master comprehension, you'll spend some time, you'll do the entire foundation module properly, you'll understand, and you'll take some of these quizzes and everything.",agent
71,23:32,"Once that is quickly done, we'll move on to critical reasoning.",agent
71,23:35,"So in critical reasoning, you have all these 10 topics, inference, assumptions, strengthen, weaken, boldface.",agent
71,23:41,These are all the topics.,agent
71,23:43,Your goal is to build expertise in all these topics in the next one week.,agent
71,23:50,"Day one, day 2, day three, day four, day 5, all these topics need to be done in five days or so.",agent
71,23:55,"That that is, that is the idea now.",agent
71,23:57,Now the good The thing is whenever you open a so there are two things you have to do these topics in the right sequence.,agent
71,24:05:00,"First you have to learn what is premise, what is conclusion.",agent
71,24:09:00,Then you have to learn what is inference.,agent
71,24:10:00,Then you have to figure out how to find assumptions.,agent
71,24:13:00,"Then evaluate strength and we can in that sequence only you have to do if you skip the sequence, it will be very logical way of studying.",agent
71,24:20:00,So that will be a big problem.,agent
71,24:22:00,That's that's that sequence is very important and these kind of sequences and all will not be there in that OG book.,agent
71,24:28:00,That OG book is straightforward practice.,agent
71,24:30:00,That's why I'm recommending not to do that alone.,agent
71,24:33:00,"Then whenever you open a topic, you'll see a bunch of files here.",agent
71,24:37:00,But there is a right way of doing here.,agent
71,24:39:00,"For example, this 2.1 to 2.5, these are all concept video lessons each 20 minutes video lesson would be there.",agent
71,24:45:00,"So concept video lessons will try to teach the theoretical part of it, what is inference, So how to do it, how to visualize all those things theoretical part.",agent
71,24:53:00,"Now, the most important thing here is every video lesson after 20 minutes, it ends with a quiz that you have to take that quiz and I need to see a very good score, 80 percent, 90% or 100%, something like that.",agent
71,25:05:00,That has to happen.,agent
71,25:06:00,That that that is the idea.,agent
71,25:07:00,"If you are getting very good scores, then obviously you're doing well.",agent
71,25:12:00,"If you get a low score, let's say you did a video lesson, you got a low score, 40 percent, 50%.",agent
71,25:18:00,That means you did not understand this concept.,agent
71,25:21:00,It is an explicit feedback.,agent
71,25:23:00,"You have to do something about that, that if you get a low score, redo the video lesson, try to get a better understanding of it or look at the solutions of the questions that you got incorrect and try to understand why exactly you, you, you went wrong.",agent
71,25:34:00,"While while solving those questions, you have to put in that additional effort.",agent
71,25:38:00,"When you put in that additional effort, you will take these couple of additional practice quizzes.",agent
71,25:44:00,"There I need to see 80 percent, 80%.",agent
71,25:46:00,"If you get a 40% score here, that's OK, as long as you get 80 percent, 80% here, that's the idea.",agent
71,25:52:00,"So learn something, do the test.",agent
71,25:54:00,"If the test is bad, relearn it, take a fresh test and get a good score, continuous loop.",agent
71,26:01:00,So that's what we'll do.,agent
71,26:03:00,Then comes application video lessons.,agent
71,26:05:00,"Till now you learnt the theory of inference, you know the theory, but how do you solve the questions?",agent
71,26:11:00,"When you see a question, what is your step one?",agent
71,26:13:00,What is your Step 2?,agent
71,26:14:00,What is your step three?,agent
71,26:15:00,"That step by step method you have to learn from this application video lessons again, they'll there will be quizzes at the end.",agent
71,26:22:00,"You have to get 80 percent, 90%, eighty percent, 90%, something like that.",agent
71,26:26:00,"If that happens, that means you are able to solve the questions.",agent
71,26:29:00,"You, you know the theory, you know the method and the method is working for you.",agent
71,26:34:00,That's what it would mean.,agent
71,26:35:00,"At that point, we will do immediately some additional practice and you'll have to get all good scores That, that, that is the idea there.",agent
71,26:42:00,"So all these numbers together, they're telling me a story about your your performance in the topic inference, whether you are an expert in inference or still some weaknesses there in inference or do we have to do the entire inference Once again, something whatever it is, we'll get to know from these numbers.",agent
71,26:58:00,That is the idea.,agent
71,27:00:00,"So clear till now, right?",agent
71,27:02:00,Yeah.,prospect
71,27:03:00,"Oh, OK, that is good.",agent
71,27:04:00,And each and every topic as well will be like that.,agent
71,27:07:00,"Only whichever topic you open, you'll have to do the concept, application, practice quizzes and you'll have to get all these good scores.",agent
71,27:14:00,That is the one topic at a time.,agent
71,27:15:00,"So day one, inference and assumption over day 2, evaluate and strengthen over.",agent
71,27:20:00,"Day three, weekend is over, Day 4, boldface is over.",agent
71,27:23:00,"So in 5-6 days, you have to wrap up the entire thing.",agent
71,27:26:00,I mean that we have to do that oral.,agent
71,27:28:00,We don't have much choice there.,agent
71,27:30:00,"Now one one additional step here is that in the EG MAT course, whenever you are taking these bunch of quizzes, you kind of have to figure out whether the score is good or not.",agent
71,27:41:00,"For example, this 50% may be a good score actually, because the quiz is very difficult here.",agent
71,27:46:00,This 86% may not be a good score because this quiz may be easier.,agent
71,27:51:00,So there could be some differences like that.,agent
71,27:53:00,So what we do is we have this some tool called Journey View.,agent
71,27:57:00,"Whenever you take a quiz here, you will compare yourself with other people.",agent
71,28:02:00,"For example, in this particular quiz application tool, everybody else on the EG MAP platform on an average got 50% score.",agent
71,28:10:00,You got a 75% score.,agent
71,28:12:00,That means you are outperforming others.,agent
71,28:14:00,That's what we want.,agent
71,28:15:00,So grade is a grade.,agent
71,28:16:00,A grade means you are performing better than others.,agent
71,28:19:00,B grade means you are performing exactly same as others.,agent
71,28:22:00,Other people got 75.,agent
71,28:23:00,You also got 75.,agent
71,28:25:00,"That 75 number looks bigger, but it's not really a great score.",agent
71,28:29:00,That's what it is.,agent
71,28:30:00,Grade B means grade C means you are performing lower than others.,agent
71,28:35:00,That's when you have to redo the entire video lesson.,agent
71,28:38:00,So grade A grade B is fine.,agent
71,28:41:00,Fine.,agent
71,28:41:00,Grade C is not fine at all.,agent
71,28:43:00,That that is the idea.,agent
71,28:44:00,"And when you do the entire critical reasoning course completely in the next 5-6 days, you will see these learning level grades as well.",agent
71,28:51:00,All the topics will be clubbed into 4 levels and overall you are getting A grade.,agent
71,28:56:00,"All these 4A grades me, your account should look like this.",agent
71,28:59:00,I need to see all A grades.,agent
71,29:00:00,That means your preparation has been done very well.,agent
71,29:03:00,"You know all the concepts of critical reasoning, you know the right method to solve the questions, and you have solved A bunch of questions, and the method is working for you.",agent
71,29:11:00,That means you're getting all A grades.,agent
71,29:13:00,"So if you get all A grades, that means you're almost done with CR.",agent
71,29:17:00,You're ready for CR.,agent
71,29:18:00,"If I see B grade, C grade, something like that, that means no, you're not done with CR.",agent
71,29:22:00,Still you have problems.,agent
71,29:24:00,That's the idea.,agent
71,29:26:00,"These grades are an indicator for us till now, clear, right?",agent
71,29:29:00,The overall philosophy of it.,agent
71,29:31:00,"So you start with critical reasoning in that you have a target of five days to complete critical reasoning we have, we have to wrap up each and every topic.",agent
71,29:38:00,"In each topic you have the theory lessons, application lessons, practice quizzes and get all good scores.",agent
71,29:43:00,That's the idea now.,agent
71,29:47:00,"So we said you have to get to a 90th percentile score in about one week or so, 8 days or so, five days, six days you have spent on the learning aspects and practice aspects, whatever we have discussed till now.",agent
71,30:00:00,5-6 days you took the next two days you have to do assessments.,agent
71,30:05:00,So that's what we will discuss.,agent
71,30:06:00,"Now you will go to this quizzing platform, Wordbill Scholaranium.",agent
71,30:09:00,"So you can actually follow these instructions as it is because I'll give you the video recording, I'll do the I'll give you this.",agent
71,30:15:00,"But yeah, so you'll have to go to this Verbal Scholar Indium quizzing platform.",agent
71,30:19:00,"You will, you will take something called cementing quizzes.",agent
71,30:23:00,These are the standardized quizzes here in Critical Reasoning.,agent
71,30:27:00,"You will have to take about 3 to 4 medium difficulty level quizzes, three to four very hard difficulty level quizzes as well.",agent
71,30:34:00,"And the platform will give you some target scores, like you want to get to 90th percentile in critical reasoning.",agent
71,30:43:00,"That means in hard level questions, at least 70% accuracy should be there.",agent
71,30:48:00,"In medium level questions, at least 90% accuracy should be there.",agent
71,30:52:00,"You when you take these bunch of quizzes, you have to hit all those targets.",agent
71,30:56:00,"5, you took 5 medium difficulty level quizzes, 9090909090.",agent
71,31:01:00,"You took five hard difficulty level quizzes, 70%, Seventy percent, 70 percent, 70%.",agent
71,31:06:00,"If this happens, you're actually done with critical reasoning that that that is the idea there and you will actually see all those scores and, and this kind of graphs and all will be parted.",agent
71,31:17:00,"For example, this is the student who took the medium difficulty level quizzes for critical reasoning.",agent
71,31:23:00,"This guy's target is set at 70% and quiz number one, this guy got 50%.",agent
71,31:30:00,That's why we are calling it fail.,agent
71,31:31:00,You have failed in that particular quiz.,agent
71,31:33:00,That's OK.,agent
71,31:34:00,"If here in this particular quizzing stage, if you're getting lower scores, it's completely OK.",agent
71,31:40:00,That's why we are reserving 2 days or three days for this entire stage.,agent
71,31:44:00,"Because what we will do is if you get low scores, you'll go to the skill data section and within critical reasoning at a topic level, you can actually see what is happening.",agent
71,31:53:00,"Like whenever we give you questions from this particular topic, your scores are very good.",agent
71,31:57:00,"But whenever we give you questions from this boldfest topic, your score is not good.",agent
71,32:01:00,"In hard difficulty level, there is a red flag.",agent
71,32:03:00,You're getting lower.,agent
71,32:04:00,"Of course, in medium difficulty level, score is OK, timing is bad.",agent
71,32:08:00,We can see that here.,agent
71,32:09:00,"So you if you get a low score, you would identify the weak area here.",agent
71,32:14:00,You would work on the weak area.,agent
71,32:15:00,How would you work on the weak area?,prospect
71,32:16:00,"You would have to go back and do the learning modules once again, revise them.",agent
71,32:20:00,You'll have to analyze the solutions of the questions that you got incorrect here.,agent
71,32:24:00,Spend some time on the solutions and try and figure out where did I go wrong?,agent
71,32:28:00,"And once the traditional effort is put in, then we will take a fresh set of quizzes.",agent
71,32:32:00,"So that's what, that's why you can see this, right?",agent
71,32:34:00,Quiz #150% looked at the weak areas and revised them on the same day.,agent
71,32:39:00,"Quiz #270% again did the looked at the weak areas and worked on them, then got 90% and 90%.",agent
71,32:47:00,So the target is set at 70%.,agent
71,32:49:00,"This guy is getting 90 percent, 90%, so done.",agent
