transcript_id,timestamp,text,speaker
47,13:57,"When you become an active leader, your understanding of the passive increases by 80%.",agent
47,14:02,That's the first thing.,agent
47,14:03,The second thing that happens is that your retention is more because you have been actively reading everything in the passage.,agent
47,14:09,"So you remember, OK, I read this, I read that.",agent
47,14:11,And the third thing that happens is your recall is faster because you have been that engaged and then your recall improves.,agent
47,14:20,Then what happens is that you don't have to go back to passage and really did to answer every single question.,agent
47,14:27,That means saving a huge amount of time on exam.,agent
47,14:32,"And this skill will come very, very handy in DI also because DI questions are super lengthy to read.",agent
47,14:38,"They're just very, very verbose.",agent
47,14:41,"And then once you become a manager too, the skill will come when you will come handy when you start reading, say, news reports and you know, case studies on at your job.",agent
47,14:54,So a life skill to get.,agent
47,14:57,Now let's start with Verbal.,agent
47,15:00,"OK, so in verbal for both CR and RC, our first module is the Foundation Concepts.",agent
47,15:08,"In CR, the first thing that we do is we teach you how to identify a conclusion in in ACR argument because that's the most important part of the argument because most of the questions centered around conclusion.",agent
47,15:23,"Once you learn that the following modules map to the kind of CR questions that you face on G Nat, which are six types inference, assumption, evaluates, trend, then beacon and boldface.",agent
47,15:37,"These are the major categories that we look at, OK?",agent
47,15:42,"So after that, we basically we tell our students to focus more on module and assumptions because if these two modules you're able to master inference will help you master strengthen and weaken because they are nothing but inference questions with a little specificity that OK, find the strengthener for the conclusion or find the weakener for the.",agent
47,16:03,"So these are all inferences, but nothing else.",agent
47,16:05,"And then if you learn whatever you're learning in assumptions, that will help you answer, evaluate and boldface.",agent
47,16:12,You just need the same skills.,agent
47,16:13,So assumption will fill that up for you.,agent
47,16:16,And So what do we have in inference?,agent
47,16:18,There are 14 lessons now.,agent
47,16:21,They are not randomly put there.,agent
47,16:23,There is a structure to every module.,agent
47,16:25,Also three parts to every module.,agent
47,16:28,"In the first part of the module, you learn all the necessary concepts that you need to know to answer inference questions correctly.",agent
47,16:36,"And mind you, out of these 14 files, only 5 are lessons.",agent
47,16:41,Rest all the 9 are nothing but quiz files.,agent
47,16:44,Yes they are quiz practice files right?,prospect
47,16:48,And in fact every single lesson also they start with a small quiz and they end with a mini quiz to make sure.,agent
47,16:56,Basically to give you the feedback as to how well you have learned that particular lesson like we would have in school.,agent
47,17:02,You know they would administer on small tests just like that.,agent
47,17:06,OK.,agent
47,17:07,The second part of the module is the application file where we teach you the three-step process to solve every single CR question.,agent
47,17:15,And then we take you to the practice files where you marry the applications with the concepts and now apply them on GMAP light question.,agent
47,17:25,"With every next practice file that you move on to, the questions start becoming complicated more.",agent
47,17:32,"And so we basically we are working on your ability to 1st apply concepts and application on easier questions, then on medium questions and then on part questions.",agent
47,17:43,Do you have any questions at this point?,agent
47,17:45,"No, no.",prospect
47,17:47,Looks OK Makes sense.,prospect
47,17:49,"Looks OK, makes sense.",agent
47,17:50,"OK, so now you can see that there are certain score against each and every lesson that we have.",agent
47,17:57,These are all scores of your quizzes that you would be attempting in every lesson.,agent
47,18:02,"Now you may ask, hey, what is a good score?",agent
47,18:05,Do I need to get 100% in every single file?,agent
47,18:08,"No, not really.",agent
47,18:10,Just stay above the median.,agent
47,18:12,"Then you will be good and then you can ask me, OK, So what is the median score?",agent
47,18:17,So right now we are looking at the course in the modules where there is something called Journey view.,agent
47,18:23,"Also when we do the journey view, we don't see the modules, we see the learning lessons and we see that we get grades over here.",agent
47,18:30,"OK, so if you click on Foundation CR and you click on activity performance, the first foundation module and the inference module are part of this.",agent
47,18:41,"And if you check the median score over here, everything is mentioned here.",agent
47,18:47,"If you score more than the median, that's when you get grade A.",agent
47,18:53,"If you score equal to the median, you get grade B.",agent
47,18:57,"Anything below the median will get you grade C, which is a big red flag.",agent
47,19:02,"If you get grade C, What you need to do is look at the question that you got wrong.",agent
47,19:07,"Look at the solution, compare it with your process that what you did to get the answer wrong.",agent
47,19:12,"If needed, go back to that pertinent portion in that video lesson where that particular topic has been taught so that you know what mistake you made and you know how to fix it.",agent
47,19:23,"So that when you move on to the next lesson and attempt the next quiz, you do not make the same mistake.",agent
47,19:30,"But do you think that do you think that in this moment where I'm still learning and doing this first quizzes, I should get concerned about the time that I take him to answer the question I or should concern about getting it right, getting it right?",prospect
47,19:44,Because you will see none of our questions are timed.,agent
47,19:47,"None of our quizzes are timed anyway, so that's a very good question to ask .",agent
47,19:53,"Stage one, we will only focus on learning things the right way and getting to that accuracy.",agent
47,20:01,We are not working on time time.,agent
47,20:03,We will work on Stage 2 and Stage 3.,agent
47,20:06,Nice OK right and and you will find that none of these quizzes have any time timer on them.,prospect
47,20:11,"You can take as long as you want, but we want you to get those grade A's.",agent
47,20:16,"So grades, that's why we are looking at try to take get as many A's as possible.",agent
47,20:21,"OK, so this is where you can come and check how much grade have you gotten?",agent
47,20:25,"And there you need help Now, , if you decide to come on on board, EG Mat, you will be provided a mentor with whom you can communicate through emails.",agent
47,20:35,"Say if you get stuck with, you know, grade C in one of the files or two of the files, and you say, hey, I was doing pretty good.",agent
47,20:42,Could you just take a look at those two lessons and my quizzes and let me know why did I score grade C?,agent
47,20:49,Because I'm really not able to wrap my head around it and tell me what's the what's the solution to get back up to grade A again?,agent
47,20:57,So they will help you navigate through the course also.,agent
47,21:01,"OK, OK.",agent
47,21:01,"And so come, we'll come back to that.",agent
47,21:04,"This is the way you will finish inference assumption evaluates from then and all of that, you know, and as you keep moving, the modules will start getting shorter and shorter because most of the things you have already covered in inference and assumption.",agent
47,21:17,"So rest of them just introduction to these type of question and nothing else, but just get getting into the practice of all of that.",agent
47,21:26,"OK, then we have the last module for you, some miscellaneous kind of questions that you may see here and there, but we we just have it so that you're at least familiar with that.",agent
47,21:36,"Once this module is done, you have spent enough time, about 41 hours on your CR stage 1.",agent
47,21:45,Stage 1 is done.,agent
47,21:47,Any questions before I take you to stage C?,agent
47,21:50,Stage two?,agent
47,21:51,"No, no, it's OK.",prospect
47,21:53,OK.,agent
47,21:53,Mm hmm.,agent
47,21:54,Now it's time to work on your accuracy and timing both.,agent
47,22:02,"OK, now we will come to the timed quiz where we will see whether the process has become intuitive to you or not.",agent
47,22:09,So this is our quizzing platform which we call Scholaranium.,agent
47,22:14,We are at Verbal Scholaranium.,agent
47,22:15,Now you have just finished your CR course and now we will take you to our stage 2 which we call cementing quizzes.,agent
47,22:23,Cementing quizzes have been have been divided into two parts Medium cementing and hard cementing.,agent
47,22:30,So how do we clear medium cementing?,agent
47,22:32,We ask you to take 5 quizzes.,agent
47,22:35,"These quizzes are short ones, five to six questions each, not nothing too demanding.",agent
47,22:40,So we ask you to take 5 quizzes and at least three of them must have 70% or more accuracy.,agent
47,22:50,That's your threshold to get past three.,agent
47,22:53,And these are timed quizzes mind you.,agent
47,22:55,"So we will look into your accuracy as well, your timing aspect as well.",agent
47,23:00,"OK, once you get the, then once we get that graph that OK, we see three dots over this broken green line.",agent
47,23:07,We know you have cleared your medium cementing.,agent
47,23:10,You are ready to move on to your hard cementing.,agent
47,23:13,Now questions will become harder.,agent
47,23:15,"Mind you, , we are looking at 685, which is 96 percentile and in order to get to that score, we actually need to face more medium and harder questions.",agent
47,23:27,Easier questions will not cut it for us.,agent
47,23:30,"OK, so it's important that we get accuracy in our medium and hard questions.",agent
47,23:34,"OK, then we take you to hard, hard cementing again the same drill 5 quizzes, but three, at least three must have more than 55% accuracy.",agent
47,23:47,"So again, above the dotted line we you need to see three dots at least over here for your OK cementing to be done.",agent
47,23:56,"So this way you would have done 50, sorry 10 quizzes over here, about 50 to 60 questions.",agent
47,24:05:00,Only in stage 260 questions are good enough to get that process cemented that you are that you have learnt in stage 1.,agent
47,24:14:00,"Think about when you went, you know, maybe say driving.",agent
47,24:18:00,"You know, there were so many things to work on the first day.",agent
47,24:21:00,"Hand eye coordination, look at your mirrors, look at your rearview mirror, maintain your lane.",agent
47,24:26:00,Not swirling around here with a lot.,agent
47,24:28:00,"But you know, once you started driving more and more and more, you started with a small empty parking lot.",agent
47,24:33:00,Then we started going onto our local roads and finally onto the highways.,agent
47,24:37:00,So we built up our ability slowly.,agent
47,24:39:00,That's exactly what we are doing in stage one.,agent
47,24:42:00,We will give you all the ability to navigate when we bring you to Scholaranium.,agent
47,24:47:00,Here we are letting you lose first in your in your city streets and then taking you to the hub.,agent
47,24:54:00,That's OK Nice of doing this.,prospect
47,24:56:00,OK.,agent
47,24:56:00,"Now once your CR is done, we will go back to the course and we will finish our reading comprehension in exactly the same manner.",agent
47,25:05:00,"Our first module is very, very important over here where you learn strategies, how to remain engaged even with the harder passages with certain strategies.",agent
47,25:15:00,"It's like note taking, looking at the keywords, following the transition, and following what the author is trying to tell us through this passage.",agent
47,25:25:00,"OK, this is the most important one over here.",agent
47,25:28:00,Make sure that you you get all the grade grades A over here.,agent
47,25:33:00,And then the next 4-1 are the four different kinds of RC questions that you see.,agent
47,25:38:00,Nothing too much to worry about over here.,agent
47,25:41:00,"These are really shorter concepts we just introduce you to OK, this is how detailed question are worded.",agent
47,25:48:00,This is where you need to work on if your detailed question comes and other steps related to that.,agent
47,25:54:00,"Then we will bring you to the application file of RC where we will serve you 9 passages starting with four easy, then taking you to 5 medium and we will round up stage one with seven hard passages.",agent
47,26:10:00,SO16 passages starting from easy ending with hard in your first stage as well.,agent
47,26:18:00,"OK, OK, once again, criteria is there.",prospect
47,26:21:00,Stay above medium.,agent
47,26:23:00,Get grade A in all of these.,agent
47,26:26:00,"OK, once this is done, it's time to move on to Stage 2 and Stage 2.",agent
47,26:31:00,"Once again, the cementing criteria throughout every subsection remain the same.",agent
47,26:38:00,"For medium 3, cementing with 70% or more, hard cementing at least three of them with 55% or that's all we require.",agent
47,26:46:00,"OK, Once you have done that also for RC, you've solved some 100 to 140 questions only in your Stage 2 combining CR and RC.",agent
47,26:55:00,"Now it's time to take you to Stage 3 of verbal, which is sectional mock.",agent
47,27:01:00,"So we will give you only the verbal sectional mock 45 minutes, 23 questions.",agent
47,27:06:00,"Let's see how far, how close we we have come to the target set by our planner.",agent
47,27:11:00,"OK, OK.",prospect
47,27:12:00,"And yeah, So there are 50 sectional box all across the board, 15 for DI, 15 for verbal and 15 for content, 5 here and there.",agent
47,27:22:00,"So we have ample mock tests, sectional mock tests to Ray Tube.",agent
47,27:27:00,Any questions?,agent
47,27:29:00,"No, no, makes sense.",prospect
47,27:31:00,"Really, really clear.",prospect
47,27:32:00,"Oh, OK, so now we will.",agent
47,27:34:00,"So now that your verbal is over, we will get you started with quant and your drill will remain absolutely the same.",agent
47,27:42:00,"You will first go through stage one in quant, Quant basics.",agent
47,27:49:00,"Here we will just help you brush up a simple, some simple concepts that you might see going forward.",agent
47,27:59:00,"Now I want to talk about one feature that we have only in our contours, nowhere else.",agent
47,28:05:00,It's called Pace View engine.,agent
47,28:07:00,Now Pace View Engine what because point course is very tedious.,agent
47,28:11:00,We have 3 sections only for arithmetic and they are pretty long thing.,agent
47,28:15:00,And let me take you to one of those over there say word problem.,agent
47,28:19:00,"There are already so many modules over here, at least eight of them, OK?",agent
47,28:25:00,And they are pretty longer modules.,agent
47,28:27:00,"So what we have done is that in order order to make sure that you don't spend time doing everything in the course and only work on that requires your attention, we have put diagnostic quizzes right at the beginning of every single module.",agent
47,28:44:00,So there is a concept diagnostic and there is AG Map skill diagnostic.,agent
47,28:49:00,"Go ahead, give that diagnostic and let the system decide what needs your attention and what does not need your attention.",agent
47,28:58:00,So only focus on what requires your focus.,agent
47,29:02:00,You don't have to do things that you're already good at.,agent
47,29:05:00,So this will customize your or personalize your one force more for you so that you can move faster.,agent
47,29:11:00,So this is how you will move through the entire one course.,agent
47,29:16:00,"One basic first, then number properties Stage 1, stage two, word problem Stage 1, Stage 2, advanced topic Stage 1 and Stage 2, and Algebra Stage 1 and stage 2 Stage 2.",agent
47,29:28:00,"So by the time you finish everything over here in stage 2, you would have actually solved some 240 to 260 questions through these cementing quizzes, hard and medium and single section questions.",agent
47,29:47:00,"So so yeah, I, I'm on this understanding that it's better for me to focus on one section first, finish it, study all that it has in verbal, then I finish that then then I go to quant and I think in the future when I'm almost taking the test, I will just take questions and see where are my gaps.",prospect
47,30:06:00,"So this is the suggestion here, right?",prospect
47,30:09:00,Yeah.,agent
47,30:09:00,OK.,agent
47,30:10:00,That's that's what we always believe.,agent
47,30:12:00,"And each EG Matt, that you, because DI, I mean verbal and quant, they have two very different skill sets.",agent
47,30:20:00,Yeah.,prospect
47,30:21:00,"And if you're think about it, if you're only giving two hours every single day to study and if you say, OK, one hour, I'll do this, one hour I'll I will do that.",agent
47,30:31:00,"Your mind will like take time, yeah, to switch gears from 1:00 to another and you won't be able to learn anything in one go.",agent
47,30:39:00,"So we are focusing on let's just get this done once and for all, then we keep it aside.",agent
47,30:45:00,"It's like learning your taking your piano lessons all in, you know, 30 days.",agent
47,30:50:00,"So that when you're focusing totally on that, you develop that muscle memory so that even if you don't get to play for too long, once you sit and touch that key, those keys, you know how to play, it becomes that intuitional for you, right?",agent
47,31:05:00,So this is what we are doing.,agent
47,31:07:00,"However, because you would be spending almost 5 weeks or almost six weeks on your quant, every single week, we will administer a verbal mock for you so that you still keep in touch with everything that you have learned in verbal.",agent
47,31:24:00,So you will not go out of practice when you are doing verbal.,agent
47,31:27:00,"In the same way, when you come to DI, we will now give you a verbal mock also and we will give you a quant mock also.",agent
47,31:34:00,"So say Saturday you will do verbal, Sunday you will do quant and you will prepare for for your DI as well.",agent
47,31:39:00,"Again, keeping you in touch with everything that you have learned.",agent
47,31:43:00,Makes sense.,prospect
47,31:43:00,"OK, Yeah, makes nice.",prospect
47,31:45:00,"OK, so with this now this is this is when when you finish your quant preparation again, sexual mocks, we will give you 45 minutes, 21 questions.",agent
47,31:58:00,"Let's see how much we have improved and whatever little round UPS needed to be there, it would be done at this stage only.",agent
47,32:05:00,"Once this is done again, we will go back to our course.",agent
47,32:09:00,"Data insights, same thing, data sufficiency.",agent
47,32:12:00,Stage 1.,agent
47,32:13:00,Stage 2.,agent
47,32:14:00,"Gita Stage 1, Stage 2, TPA, MSR both individually.",agent
47,32:18:00,Stage 1.,agent
47,32:19:00,Stage 2.,agent
47,32:20:00,"So when you finish your stage 2 from DI again, the same number of questions you would have solved over here, 240 to 250 months.",agent
47,32:29:00,"OK, so everything would be done over here.",agent
47,32:32:00,"Once again we will give you sectional mark just for DI, just to check how much you have learned, what else is required.",agent
47,32:39:00,"Once all of that is done, that's when towards the last leg of your preparation, just the last week, we will start giving you one walk after the other.",agent
47,32:49:00,"You can decide OK, this combination of order is working for me.",agent
47,32:53:00,"Two hours is sitting for exam getting too much on me, Am I OK with everything, when to take my break, when to do thing, what time of the day shall I go and get my exams that I'm at my optimum to write everything down and so on so forth.",agent
47,33:06:00,So all those things we will decide over this period of time and I'm showing you a score of somebody who's very similar with you in your skills.,agent
47,33:18:00,", you told me, hey, shut that, you know, I I would be somewhere around 55545.",agent
47,33:23:00,This girl was also at 555 when she started her course.,agent
47,33:26:00,She was aiming at 695.,agent
47,33:29:00,"Within two months, she was able to achieve 695.",agent
47,33:32:00,This is her real score on GMAP as well.,agent
47,33:36:00,So she did get 140 point improvement.,agent
47,33:39:00,I will share her success story with you.,agent
47,33:41:00,"So that Leela, that's her name if I show you the course.",agent
47,33:45:00,Hello Leela.,agent
47,33:46:00,"That's what it says, right?",agent
47,33:47:00,So I'm gonna share her success story with you.,agent
47,33:50:00,"And so yeah, she actually made that 140 point progress in two months time.",agent
47,33:55:00,You are giving us four to five months.,agent
47,33:57:00,"Absolutely doable , even with a full time job that you are doing.",agent
47,34:02:00,"OK, nice.",prospect
47,34:03:00,I'm pretty much done showing everything that I had to show here.,agent
47,34:08:00,Now I'm ready to answer any questions that you may have from me.,agent
47,34:13:00,"No, I think my questions you, you already answered during during that time.",prospect
47,34:18:00,So I think I'm comfortable.,prospect
47,34:20:00,"I just want to understand now that we've made a plan, where do I see it?",prospect
47,34:24:00,How do how do I see it?,prospect
47,34:25:00,Where do I look?,prospect
47,34:27:00,And I just want to get started.,prospect
47,34:29:00,OK.,agent
47,34:29:00,"If you wanna get started, , what I will do is that I can share the link of this study plan with you right away on the WhatsApp.",agent
47,34:40:00,But make sure that you access this planner only when you're logged into your account.,agent
47,34:47:00,OK.,prospect
47,34:47:00,Wow.,prospect
47,34:47:00,OK.,prospect
47,34:48:00,Yeah.,agent
47,34:48:00,OK.,agent
47,34:48:00,That's when it's going to work.,agent
47,34:50:00,Otherwise it will not because you know you have not purchased the course and it is not made in your paid account.,agent
47,34:57:00,So here you are.,agent
47,35:02:00,I have shared the PSP with you already.,agent
47,35:05:00,"Now if I'm looking at the PSP, let me share my screen so that you know what I'm talking about here.",agent
47,35:14:00,OK.,agent
47,35:14:00,"So 545 to 685, it's taking us about four months, OK, June, July, sorry, Feb, March, April and May.",agent
47,35:27:00,So it's exactly taking us four months.,agent
47,35:30:00,"So I would say, , that you can buy a four month course from EG MAT to keep your subscription on for all those days.",agent
47,35:40:00,And then you can always go for a one week extension or whatever it is.,agent
47,35:45:00,You know that we can work out later if we want to keep that subscription on till 28th of May that we'll figure out how to do.,agent
47,35:53:00,"But yeah, I would suggest that a four month plan is what will work for you at this point in time if you were to buy this program, this is this will cost you 299, OK, 99 US pharma plan, 299 USD.",agent
47,36:13:00,"OK, nice.",prospect
47,36:15:00,Yes.,prospect
47,36:16:00,And I've already shared your a planner with you.,agent
47,36:19:00,"If you plan to take your as you were telling me over the text that, hey, you know, I'll look into some of the sections.",agent
47,36:26:00,"And then over the weekend, I want to do my mock test as well.",agent
47,36:30:00,"So once you write your mock test, just leave me a message that, hey, shut, I've done my mock test.",agent
47,36:35:00,Then what I will do is that I will create your planner on your real scores.,agent
47,36:41:00,"OK, nice.",prospect
47,36:42:00,Yeah.,agent
47,36:42:00,"And then you will have the real scores with your real target, everything because here I've just put in some, you know, imaginary numbers for you given that.",agent
47,36:52:00,"OK, this is you're, you're good in verbal, not so good in quantum, kinda OK ish in data itself.",agent
47,36:57:00,"But once you give me the mock test, mock test scores, then I will create the real planner for you and then I'll share share it with you.",agent
47,37:04:00,"But right now you can keep it for reference to just see that, OK, this is how every day will go and this is how what I'm going to put my course makes sense.",agent
47,37:13:00,Perfect.,prospect
47,37:14:00,"All righty , any other questions that you may have?",agent
47,37:18:00,Just a question.,prospect
47,37:19:00,I'm coming from Brazil.,prospect
47,37:20:00,Do you think that the 685 is a good is a good score for me to a because I know that there's a little bit different is if the person from USA from Europe.,prospect
47,37:29:00,I think it it has a variety.,prospect
47,37:32:00,"I think the 685 is OK, right.",prospect
47,37:35:00,"Yes, 685 is absolutely a perfect score for you don't because a lot of Indians also give GMAP Yeah.",agent
47,37:42:00,"So we tell them also that, you know, at least aim for 685.",agent
47,37:46:00,I would never encourage you to go anything be below this.,agent
47,37:50:00,"Let's at least aim for 685 and then let's work towards it and let's see where, where, where do we go.",agent
47,37:56:00,But at least 86685 is a good score.,agent
47,37:59:00,It's a very comfortable score.,agent
47,38:00:00,"I mean, if if I get 6685, I'm gonna go and sleep.",prospect
47,38:04:00,I'm not gonna worry too much about.,prospect
47,38:06:00,It's OK.,prospect
47,38:07:00,"Yeah, it's OK.",agent
47,38:07:00,Absolutely.,agent
47,38:09:00,OK.,agent
47,38:09:00,All right.,agent
